2026-01-14 19:01:42 | INFO | P01 | =================
2026-01-14 19:01:42 | INFO | P01 | === RUN START ===
2026-01-14 19:01:42 | INFO | P01 | project=Foundations of Professional Python
2026-01-14 19:01:42 | INFO | P01 | repo_dir=datafun-01-foundations
2026-01-14 19:01:42 | INFO | P01 | python=3.14.2
2026-01-14 19:01:42 | INFO | P01 | os=Windows 11
2026-01-14 19:01:42 | INFO | P01 | shell=powershell
2026-01-14 19:01:42 | INFO | P01 | cwd=.
2026-01-14 19:01:42 | INFO | P01 | github_actions=False
2026-01-14 19:01:42 | INFO | P01 | =================
2026-01-14 19:01:42 | INFO | P01 | START main()..................
2026-01-14 19:01:42 | INFO | P01 | Generated formatted multi-line SUMMARY string.
2026-01-14 19:01:42 | INFO | P01 | Returning the str to the calling function.
2026-01-14 19:01:42 | INFO | P01 | 
    Custom Information:
        Company name: DataFun Analytics
        Employee count: 150
        My role: Data Analytics Student
        Graduation year: 2027
        GPA: 3.80
        Full-time worker: True
        Tech stack: Python, SQL, Git, Linux, Java
    
2026-01-14 19:01:42 | INFO | P01 | Generated formatted multi-line SUMMARY string.
2026-01-14 19:01:42 | INFO | P01 | Returning the str to the calling function.
2026-01-14 19:01:42 | INFO | P01 | 
    Descriptive Statistics for Snowfall (inches):
        Total snowfall: 22.80 inches
        Count of measurements: 5
        Minimum snowfall: 2.50 inches
        Maximum snowfall: 6.50 inches
        Average snowfall: 4.56 inches
        Standard deviation: 1.63 inches
    
2026-01-14 19:01:42 | INFO | P01 | END main()..................
2026-01-14 19:05:14 | INFO | P01 | =================
2026-01-14 19:05:14 | INFO | P01 | === RUN START ===
2026-01-14 19:05:14 | INFO | P01 | project=Foundations of Professional Python
2026-01-14 19:05:14 | INFO | P01 | repo_dir=datafun-01-foundations
2026-01-14 19:05:14 | INFO | P01 | python=3.14.2
2026-01-14 19:05:14 | INFO | P01 | os=Windows 11
2026-01-14 19:05:14 | INFO | P01 | shell=powershell
2026-01-14 19:05:14 | INFO | P01 | cwd=.
2026-01-14 19:05:14 | INFO | P01 | github_actions=False
2026-01-14 19:05:14 | INFO | P01 | =================
2026-01-14 19:05:14 | INFO | P01 | START main()..................
2026-01-14 19:05:14 | INFO | P01 | Generated formatted multi-line SUMMARY string.
2026-01-14 19:05:14 | INFO | P01 | Returning the str to the calling function.
2026-01-14 19:05:14 | INFO | P01 | 
    Custom Information:
        Company name: DataFun Analytics
        Employee count: 150
        My role: Data Analytics Intern
        Graduation year: 2027
        GPA: 3.90
        Full-time worker: True
        Tech stack: Python, SQL, Git, Linux, Java
    
2026-01-14 19:05:14 | INFO | P01 | Generated formatted multi-line SUMMARY string.
2026-01-14 19:05:14 | INFO | P01 | Returning the str to the calling function.
2026-01-14 19:05:14 | INFO | P01 | 
    Descriptive Statistics for Snowfall (inches):
        Total snowfall: 22.80 inches
        Count of measurements: 5
        Minimum snowfall: 2.50 inches
        Maximum snowfall: 6.50 inches
        Average snowfall: 4.56 inches

        Standard deviation: 1.63 inches
    
2026-01-14 19:05:14 | INFO | P01 | END main()..................
2026-01-14 19:06:58 | INFO | P01 | =================
2026-01-14 19:06:58 | INFO | P01 | === RUN START ===
2026-01-14 19:06:58 | INFO | P01 | project=Foundations of Professional Python
2026-01-14 19:06:58 | INFO | P01 | repo_dir=datafun-01-foundations
2026-01-14 19:06:58 | INFO | P01 | python=3.14.2
2026-01-14 19:06:59 | INFO | P01 | os=Windows 11
2026-01-14 19:06:59 | INFO | P01 | shell=powershell
2026-01-14 19:06:59 | INFO | P01 | cwd=.
2026-01-14 19:06:59 | INFO | P01 | github_actions=False
2026-01-14 19:06:59 | INFO | P01 | =================
2026-01-14 19:06:59 | INFO | P01 | START main()..................
2026-01-14 19:06:59 | INFO | P01 | Generated formatted multi-line SUMMARY string.
2026-01-14 19:06:59 | INFO | P01 | Returning the str to the calling function.
2026-01-14 19:06:59 | INFO | P01 | 
    Custom Information:
        Company name: DataFun Analytics
        Employee count: 150
        My role: Data Analytics Intern
        Graduation year: 2027
        GPA: 3.90
        Full-time worker: True
        Tech stack: Python, SQL, Git, Linux, Java
    
2026-01-14 19:06:59 | INFO | P01 | Generated formatted multi-line SUMMARY string.
2026-01-14 19:06:59 | INFO | P01 | Returning the str to the calling function.
2026-01-14 19:06:59 | INFO | P01 | 
    Descriptive Statistics for Snowfall (inches):
        Total snowfall: 22.80 inches
        Count of measurements: 5
        Minimum snowfall: 2.50 inches
        Maximum snowfall: 6.50 inches
        Average snowfall: 4.56 inches

        Standard deviation: 1.63 inches
    
2026-01-14 19:06:59 | INFO | P01 | END main()..................
2026-01-14 19:43:49 | INFO | P01 | Generated formatted multi-line SUMMARY string.
2026-01-14 19:43:49 | INFO | P01 | Returning the str to the calling function.
